{
  "$schema": "references/creative-genome/schemas/reference-candidates.schema.json",
  "content_id": "2026-W32-ship-now-vs-consolidate-linkedin-01",
  "query_contract": {
    "care_statement": "Freight savings matter only if the customer date remains protected; the reader should leave with a reusable service-first decision order, uncertainty gate, and escalation path.",
    "content_modes": [
      "reasoned model only",
      "worked demonstration",
      "first-party result/test",
      "named real-world case",
      "decision/reference artifact",
      "executable/interactive",
      "completed example only"
    ],
    "reader_decision": "Purchasing practitioners, KAMs, logistics colleagues, and planning managers deciding whether a ready shipment should leave now or wait for another compatible PO without risking the customer need-by date."
  },
  "query_id": "RQ-2026-W32-C3-SHIP-NOW-VS-CONSOLIDATE-V1",
  "query_sha256": "db2e32d5bd35b485230d4e19d9e48ad798f8fa16da5feb11039e216308798204",
  "result_count": 15,
  "results": [
    {
      "annotations": {
        "artifact_type": {
          "basis": "Stage-0 automated code plus rule-based enrichment",
          "confidence": "low-to-medium; Stage-0 meaning reliability gate failed",
          "evidence_limit": "Tags are hypotheses for manual review, not causal or decision-grade labels.",
          "status": "heuristic_unverified",
          "value": "decision/reference artifact"
        },
        "cta": {
          "basis": "Stage-0 automated code plus rule-based enrichment",
          "confidence": "low-to-medium; Stage-0 meaning reliability gate failed",
          "evidence_limit": "Tags are hypotheses for manual review, not causal or decision-grade labels.",
          "status": "heuristic_unverified",
          "value": "none"
        },
        "format": {
          "basis": "Stage-0 automated code plus rule-based enrichment",
          "confidence": "low-to-medium; Stage-0 meaning reliability gate failed",
          "evidence_limit": "Tags are hypotheses for manual review, not causal or decision-grade labels.",
          "status": "heuristic_unverified",
          "value": "single static image"
        },
        "hook_type": {
          "basis": "Stage-0 automated code plus rule-based enrichment",
          "confidence": "low-to-medium; Stage-0 meaning reliability gate failed",
          "evidence_limit": "Tags are hypotheses for manual review, not causal or decision-grade labels.",
          "status": "heuristic_unverified",
          "value": "plain premise/announcement"
        },
        "job_to_be_done": {
          "basis": "Stage-0 automated code plus rule-based enrichment",
          "confidence": "low-to-medium; Stage-0 meaning reliability gate failed",
          "evidence_limit": "Tags are hypotheses for manual review, not causal or decision-grade labels.",
          "status": "heuristic_unverified",
          "value": "prevent/fix failure"
        },
        "problem_family": {
          "basis": "Stage-0 automated code plus rule-based enrichment",
          "confidence": "low-to-medium; Stage-0 meaning reliability gate failed",
          "evidence_limit": "Tags are hypotheses for manual review, not causal or decision-grade labels.",
          "status": "heuristic_unverified",
          "value": "inventory and replenishment"
        },
        "promise": {
          "basis": "Stage-0 automated code plus rule-based enrichment",
          "confidence": "low-to-medium; Stage-0 meaning reliability gate failed",
          "evidence_limit": "Tags are hypotheses for manual review, not causal or decision-grade labels.",
          "status": "heuristic_unverified",
          "value": "DEMAND PLANNING (NEXT LEVEL) Most people forecast. Few actually plan."
        },
        "proof_type": {
          "basis": "Stage-0 automated code plus rule-based enrichment",
          "confidence": "low-to-medium; Stage-0 meaning reliability gate failed",
          "evidence_limit": "Tags are hypotheses for manual review, not causal or decision-grade labels.",
          "status": "heuristic_unverified",
          "value": "reasoned model only"
        },
        "target_audience": {
          "basis": "Stage-0 automated code plus rule-based enrichment",
          "confidence": "low-to-medium; Stage-0 meaning reliability gate failed",
          "evidence_limit": "Tags are hypotheses for manual review, not causal or decision-grade labels.",
          "status": "heuristic_unverified",
          "value": "planners and planning managers"
        },
        "topic": {
          "basis": "Stage-0 automated code plus rule-based enrichment",
          "confidence": "low-to-medium; Stage-0 meaning reliability gate failed",
          "evidence_limit": "Tags are hypotheses for manual review, not causal or decision-grade labels.",
          "status": "heuristic_unverified",
          "value": "forecast quality and decision consequences"
        },
        "visual_structure": {
          "basis": "Stage-0 automated code plus rule-based enrichment",
          "confidence": "low-to-medium; Stage-0 meaning reliability gate failed",
          "evidence": null,
          "evidence_limit": "A preview or text-derived classification cannot verify detailed visual mechanics.",
          "inspection_level": "preview_only",
          "status": "heuristic_unverified",
          "value": "comparison or matrix"
        }
      },
      "canonical_url": "https://www.linkedin.com/feed/update/urn:li:activity:7449046219600982016",
      "creative_assets": {
        "top100_references": [
          {
            "caption_index_path": "references/top100-caption-index.md",
            "local_asset_path": "references/top 100/89.jpeg",
            "reference_number": 89,
            "visual_inspection_required": true
          }
        ]
      },
      "creator": "Ronalin L.",
      "diversity_signature": "plain premise/announcement | comparison or matrix | decision/reference artifact",
      "observed_caption_excerpt": "DEMAND PLANNING (NEXT LEVEL) Most people forecast. Few actually plan. Everyone knows the basics: What • When • How Much But real demand planning starts when you ask: Why is demand changing—and what will it cost if I’m wrong? 1. Not all demand behaves the same Stable → optimize cost Seasonal → manage timing Trend → control scaling risk Irregular → protect with buffers Misclassification = wrong inventory, wrong decisions. 2. There is no universal forecasting model Stop applying one method to all SKUs. Match model to behavior. Segment demand properly. Accept trade-offs (accuracy vs responsiveness",
      "observed_hook": "DEMAND PLANNING (NEXT LEVEL)",
      "positive_signals": {
        "saved_positive": true,
        "tiger_native_performance": false,
        "top100_curated_reference": true
      },
      "reference_id": "LI-7449046219600982016",
      "retrieval_matches": [
        "artifact:decision/reference artifact",
        "content_mode:decision/reference artifact|reasoned model only",
        "cta:none",
        "source:saved_positive",
        "source:top100_curated_reference",
        "token_overlap:and|cost|decision|if|model|or|planning|real|risk|service",
        "topic:cost|decision|risk|service|trade-off",
        "visual:comparison or matrix"
      ],
      "retrieval_score": 62,
      "visual_use_guardrail": "Treat visual structure as a retrieval hint until the source visual is inspected."
    },
    {
      "annotations": {
        "artifact_type": {
          "basis": "Stage-0 automated code plus rule-based enrichment",
          "confidence": "low-to-medium; Stage-0 meaning reliability gate failed",
          "evidence_limit": "Tags are hypotheses for manual review, not causal or decision-grade labels.",
          "status": "heuristic_unverified",
          "value": "copyable operating asset"
        },
        "cta": {
          "basis": "Stage-0 automated code plus rule-based enrichment",
          "confidence": "low-to-medium; Stage-0 meaning reliability gate failed",
          "evidence_limit": "Tags are hypotheses for manual review, not causal or decision-grade labels.",
          "status": "heuristic_unverified",
          "value": "generic discussion"
        },
        "format": {
          "basis": "Stage-0 automated code plus rule-based enrichment",
          "confidence": "low-to-medium; Stage-0 meaning reliability gate failed",
          "evidence_limit": "Tags are hypotheses for manual review, not causal or decision-grade labels.",
          "status": "heuristic_unverified",
          "value": "single static image"
        },
        "hook_type": {
          "basis": "Stage-0 automated code plus rule-based enrichment",
          "confidence": "low-to-medium; Stage-0 meaning reliability gate failed",
          "evidence_limit": "Tags are hypotheses for manual review, not causal or decision-grade labels.",
          "status": "heuristic_unverified",
          "value": "correction/distinction"
        },
        "job_to_be_done": {
          "basis": "Stage-0 automated code plus rule-based enrichment",
          "confidence": "low-to-medium; Stage-0 meaning reliability gate failed",
          "evidence_limit": "Tags are hypotheses for manual review, not causal or decision-grade labels.",
          "status": "heuristic_unverified",
          "value": "interpret current change"
        },
        "problem_family": {
          "basis": "Stage-0 automated code plus rule-based enrichment",
          "confidence": "low-to-medium; Stage-0 meaning reliability gate failed",
          "evidence_limit": "Tags are hypotheses for manual review, not causal or decision-grade labels.",
          "status": "heuristic_unverified",
          "value": "planning and forecasting"
        },
        "promise": {
          "basis": "Stage-0 automated code plus rule-based enrichment",
          "confidence": "low-to-medium; Stage-0 meaning reliability gate failed",